<?xml version="1.0" encoding="UTF-8"?>
<!-- Se desea crear un formato de intercambio de datos para una empresa mayorista de libros 
con el fin de que sus distintos programas puedan manejar la información interna. 
El formato de archivo debe tener la siguiente estructura:
El elemento raíz es «operaciones».
Dentro de «operaciones» hay uno o más elementos «operacion».
Una «operacion» puede ser «venta», «compra», o cualquier combinación y secuencia de ellas, pero debe haber al menos una.
Una venta tiene dentro un elemento «titulosvendidos». Dentro de «titulosvendidos» se almacenan estos datos:
Uno o más elementos «título».
La cantidad total de libros vendidos.
Puede haber un elemento «entregado» que indique si la entrega se ha realizado.
Debe haber un elemento importe con un atributo obligatorio llamado «moneda».
Una compra tiene dentro un elemento «tituloscomprados». Dentro de él hay esto:
Uno o más elementos «titulo»
Un «proveedor».
Una fecha de compra, que debe desglosarse en elementos día, mes y año -->

<operaciones xmlns:xs="http://www.w3.org/2001/XMLSchema-instance"
xs:noNamespaceSchemaLocation="7operaciones.xsd">
    <operacion>
        <compra>
            <titulosComprados cantidad="20">
                <titulo>Venedetti</titulo>
            </titulosComprados>
            <proveedor>Lorem</proveedor>
            <fechaCompra>2023-02-15</fechaCompra>
        </compra>
    </operacion>
    <operacion>
        <venta>
            <titulosVendidos cantidad="34">
                <titulo>Supaduapilupi</titulo>
            </titulosVendidos>
            <entregado>true</entregado>
            <importe>10.2</importe>
        </venta>
    </operacion>
</operaciones>